,name,author,title,selftext,subreddit
0,t3_i0we2n,botulizard,Beer Suggestions on r/beer And You: So You Want to Ask Reddit For A New Beer,"Hi, Howdy, Hello! No doubt you’re here because you’d like to ask r/beer to help you find a delicious beverage. You’re in luck, because there are over 400,000 people subscribed here! On the other hand...there are over 400,000 people subscribed here. Some of them probably live near you or have similar access to all of the beers available to you. Most of them don’t. What does this mean for you? Well my friend, it means you have to help us help you!

All too often, a well-meaning drinker or curious party who would like to start drinking (2020, am I right folks?) will show up on r/beer and post something like “Hi what beer should I drink kthanksbye”. This is no good. First, it doesn’t give us any information about you. In order to suggest a beer that you should buy, we have to know what beers are available for you to buy. You should start by first telling us where you are. This is absolutely the most important part.

There are a lot of national companies and behemoth corporations that can supply you with large craft beers, very large non-craft beers, and imports. Even still, not everything is everywhere. Hell, assuming all these same beers are available assumes you’re American, which you might not be. Beyond that, the people of r/beer tend to lean towards smaller craft beer producers that may not distribute their products near you. The first and most important thing you need to do is tell us where to look. For best results, put your general location (state, region, maybe even city) in the title of your post.

Next, tell us what you already drink and like. If you drink beer already, what beers do you like? Wine, liquor, coffee, tea? What kinds of flavors make the pleasure and reward centers in your brain go “hell yeah”? Give us something to go off, and we can find a beer that can do just that. What flavors don’t you like? We wouldn’t want to recommend something that you thought was gross, you’d never trust us again. How can you avoid that? Give us some good information! 

How much money are you looking to spend? Are you on a budget? Do you want to ball out with something priced like a fine wine? Let us know. How much alcohol are you trying to put in you? Beer can range from almost alcohol-free to something resembling wine or hard alcohol, it’s an incredibly versatile art form. Tell us if you want something crispy to drink while you mow the lawn or if you’re trying to go a little heavier.

Maybe you’re looking for something similar to a foreign or narrowly-distributed beer. That’s fantastic. Beer brings us together and can play a key role in creating memories to last a lifetime. That beer you had on vacation or study-abroad is special, we know. You can help us help you by describing that beer, instead of just leaving it at “I had this beer overseas, find me something like it please”. Tell us what it looks, feels, and tastes like, and we’re in a much better position to find an analogue.

Now you know what to do, so now I do have to tell you about one thing you really shouldn’t do here. Don’t seek out medical advice disguised as a beer recommendation. Not that often, but still too often, I’ll see something like “every beer I’ve ever had makes my throat close up and my ears sprout horns, what should I drink that won’t do that?” That’s not the question you should be asking. You should be asking a doctor “why does every beer i’ve ever tried make my throat close up and my ears sprout horns?” You shouldn’t be asking beer fans to find you a way around a medical problem. That’s ill-advised and dangerous. Don’t do it. We don’t know you and most of us don’t have the proper education to help you with that. Don’t do it.

There. With this information in hand, you’re now ready to ask for a beer recommendation. Just be sure to take all of this into account and you’ll be fine. You’ll inspire some good discussions and avoid getting downvoted into oblivion and trolled with recommendations of beers you can only buy in person at Belgian monasteries. 

I can’t prevent other posters from being rude in the comments, but I can arm you with the know-how to prevent them from feeling the need.If someone was unfriendly, it wasn’t your fault, you just didn’t know how to ask the right questions. Now you do!

Go in peace, be well, and drink well.

*Sláinte!*


**TL;DR**

**Important Info For Beer Recommendations**

* Where are you?

* What's your budget?

* What beers do you like and why?

* What flavors do you like generally?

* What flavors don't you like?

* etc.",beer
1,t3_wkwty3,AutoModerator,No Stupid Questions Wednesday - ask anything about beer,"Do you have questions about beer? We have answers! Post any questions you have about beer here. This can be about serving beer, glassware, brewing, etc.

Please remember to be nice in your responses to questions.  Everyone has to start somewhere.

Also, if you want to chat, [the /r/Beer Discord server](https://discord.gg/MvMVFA4Vu3) is now active, so come say hello.",beer
2,t3_wmrj0l,DocGerbil256,What is the best thematic brewery/taproom?,"I'm talking about a brewery or taproom that has an overall theme that is consistent in not only the beer names but the can art and decorum of the taproom. The 3 that I can think of that I've been to are [TRVE in Denver, CO](https://www.trvebrewing.com/) which has a metal theme with black walls, candles on the benches, and metal music playing. Then there's [Dragonsmead in Warren, MI](https://www.dragonmead.com/) which has a Medieval theme with swords, stained glass, and cheesy fantasy art on the walls. The last one I've been to is [Supernatural in Livonia, Mi]( https://www.supernaturalbrewing.com/) which has a Fortune tellers parlor theme with crystal balls, old books and rotary dial phones, and plasma balls.

I'd say of the 3 I listed TRVE probably had the best theming as it was most consistent throughout the whole brewpub, in their beer names and can art, and especially with their awesome merch. Dragonsmead gets a notable mention though as their beer is always at the Renaissance Faire and you can't say no to getting Final Absolution on tap in a wooden tankard while dressed up as a pirate.

So what about you? What do you think is the brewery with the best overall theming in their beer and taproom?",beer
3,t3_wn213p,Woah-Big-Gulps-Huh,Asheville NC brewery recommendations?,"I’ve looked at lists on Untapped, Beeradvocate, etc so have an idea of some good ones, but also like personal recs from people",beer
4,t3_wm8rnq,psychologicalprowler,"I am mexican and I’m genuinely curious, what would be the best mexican beer according to non-mexicans? I’m kinda afraid someone says Corona as most people here dislike it, but still is a valid response.",,beer
5,t3_wn0zlk,Bus-According,Detroit breweries near river,"Hey fellow beer connoisseurs! I’m going to Detroit in Sept. Wondering if there are any breweries that have a view of the river? I appreciate any and all suggestions. 
Any other suggestions on things to do is highly appreciated as well!",beer
6,t3_wmkp0o,AutoModerator,Free Talk Friday - /r/beer chat time,"Thread shitting is encouraged! Have fun, talk about your weekend plans, let us know what you will be drinking. Post pictures and memes.

/r/Beer chat has moved from the abandoned IRC channel to [our official Discord server](https://discord.gg/MvMVFA4Vu3).  So, come say hello.",beer
7,t3_wn364j,marctr,Cross posted in r/glassware. Anybody know where to find these kinds of glasses? Found in a thrift store and I love the heft of the big glass puck at the base. .5L capacity. I don’t care what brewery name is on them. Pic: https://photos.app.goo.gl/rrpcw1YD9K56cY8Y8,,beer
8,t3_wm6b4q,mrcrassic,So we drove to Tree House from Texas...,"...and holy shit, I would do it again!

My wife and I had their That's What She Said and King Julius, respectively

We left with $100 worth of cans

Best stout and double IPA we have had, possibly ever!",beer
9,t3_wmudng,UpAt5amSince1986,I got 72 cans of Old Style beer...,What kind of person drinks Old Style?,beer
10,t3_wlwflc,JasinNat,Most expensive beer you've bought?,"$46 for a 4 pack of Bells Imperial Stout?  (I forgot but, it was my local specs) Was pretty good but, not $46 good. Second highest: $25 for a 4pk KBS. Which was just ok.",beer
11,t3_wm2jys,SartoriCheese,Great Taste of the Midwest the 35th (2022),"THE LIST IS OUT: [https://program.greattaste.org/](https://program.greattaste.org/)

Spew forth your CAN'T MISS list! 🍻

Which brews have 'sleeper potential'? 🧐

Where is the Real Ale tent?! 😢

Look to my coming on the 13th day...at Olin-Turville at 6 PM, look in a bush...",beer
12,t3_wlzwjw,aimless_artist,Please help me find IPA for my guest…,"Im not from the US and have been living here for about 5ish years now. I’m an introvert and also a freelancer which means i haven’t been to many parties or met many people, which im fine with. But the downside is i have no knowledge of what people do or like or eat 🥲 especially the ones from other cultures. 
I’ll be hosting a sweet elderly white couple on sunday (my landlords) and the guy said he likes IPA beer and his wife likes hibiscus tea.
Please help me pick out a good and affordable IPA while i go and google how to make hibiscus tea and what kind of snacks i should make (please chime in if you have ideas about the food as well to go with the beer. Vegetarian options please)

Edit: I’m in Santa Barbara.",beer
13,t3_wm6k0u,October7_7,Alaskan Beer Recommendations,"I'll be up in Alaska, primarily the Anchorage area, for at least a year. I'm also planning on checking out Fairbanks. What are some breweries and brews to keep an eye out for?",beer
14,t3_wm67ua,iHOPEthatsChocolate3,New York bottle shop recommendations,"Heading to New York in a week and looking for some suggestions. Fly into the city, will be in/around Tarrytown for a day/night, and then will be driving up to West point for a wedding. 

Will have a car from Tarrytown to West point. 

I know this encompasses a large area but any suggestions for good quality bottle shops around these towns or en route between is appreciated.",beer
15,t3_wmeaqa,Dafour34,Nanobrewery Advices,"Hi there !

I have several questions and I am not too sure which thread I should put it so i'll make on block :

&amp;#x200B;

I started a nanobrewery in Cambodia and things start to turn well.

But we have many fields we can improve so I am looking for to read some ideas from people with previous experiences.

I would like to improve our accounting system is an excel sheet, totally unpleasant for the eyes and way too much time consuming ( Double typing etc.. )

I was thinking something kind of like a POS to simplify every data entries ( Spending, incomes, stocks, customers base etc...).

&amp;#x200B;

Also i would like to improve our bottle cleaning system ( we recycle from used bottles ) , so if anyone has some advices about products to use or efficient processes i'm all hears .

&amp;#x200B;

Knowing we're close to an home brew system ( 80L batches ), our investment power is limited for now and growing up as we go.

&amp;#x200B;

Thanks a lot !",beer
16,t3_wm9gtl,Koof13,Are kegs worth it?,"I’m thinking of getting a kegerator, but after looking at prices on beer kegs it seems like 30s are cheaper. Does anyone think it’s worth it?",beer
17,t3_wlgqs7,sixthsheik,The hops that built craft beer – a documentary | The Craft Beer Channel (55 minute video),,beer
18,t3_wmai89,TheBrianThompson,"I don't have a problem, but I'd like to bring a beer to the dog park lowkey. What sort of tumblers would y'all recommend. Something that holds tallboys that won't explode on a bike ride would be great.","Like I said above, I don't have a problem. I just want to pour a tallboy in a thing, put a lid on it, then bike to the dog park and watch all the dogs do their thing while drinking a beer. Any tumbler recs out there? Thanks!",beer
19,t3_wm9txz,WhichEdge,Corona and lime,"If I am a simple man that likes Corona and lime on a hot summer day what should I try? :)

I am trying to broaden out but still enjoy what I enjoy :)",beer
20,t3_wmdjsz,MuhBoiPhil,Bud Light Next,"Has anyone tasted this crap? Honestly, the only way to describe it is like drinking WOMENS PERFUME. I wanted to vomit when I tried to drink a can. 

Is this crap really legal? Are the ingredients legal? Lol. 

This crap tastes like a ladies perfume, don’t even try it.

DONT TRY IT (or do, and know what chemicals taste like).",beer
21,t3_wm8dlh,uappreciateu,Thoughts on lagunitas Maximus Colossal IPA… 9.0% ABV Ale (they didn’t have Rasputin).,,beer
22,t3_wm7ybj,warhead2354,First American Beer Style,"What is the first originally American beer Style produced? American lager, pale ale, et cetera.",beer
23,t3_wmfdnq,Robert_van_Barlingen,I want to start collecting stickers from beer companies. How to start?,You sometimes see people decorating their bar with stickers from all kinds of beer brands. But where do they get these stickers from? Do they just write the breweries directly or something? Any advise welcome.,beer
24,t3_wm4wck,bubbabooeyy,recommendations if you like Tokyo Black?,"a while back, I had Tokyo Black and I LOVED it. i have a bit of a sweet tooth and I loved that it was chocolatey and caramely, the malt mixed with gourmand flavors. i was wondering if anyone had recommendations that were similar in flavor, but more readily available?",beer
25,t3_wm4dze,timothy53,Brewery recommendations for Seattle/ Gorge amphitheater area,Headed out to the gorge would love some recommendations for a brewery that is en route from Seattle to the gorge. Love New England style IPAs and Hazy IPAs. Anywhere that will allow us to buy and carry out,beer
26,t3_wm13le,Not-OP-But-,How long would unrefrigerated beer stored just in a bottle on a shelf actually be good for?,"I have two bottles of Opeth's imperial stout they only ever made 1700 of.

One I drank when I got it and the other I still have as a collectors item.

Was considering drinking it.

However for about 7 years since I've had it it's never been in the fridge, it's never been in extreme heat or cold or sunlight. It's just sat on a shelf collecting dust.

The thought of opening it and drinking it never crossed my mind, I figured it'd have a weird texture with sediment and maybe even lost the carbonation and be flat or just weird in some way.

If I actually wanted to drink it, would putting in the fridge a few days and popping it open be just fine assuming it never experienced any shaking or anything like that?",beer
27,t3_wlqtbt,AutoModerator,Throwback Thursday - classic beers and reviews of vintage bottles,"This post has a dual purpose.       

Tell us about classic beers people are still enjoying but not talking about anymore (beers like Duvel, Allagash White, Old Rasputin, etc.).       

Also, post your review of vintage bottles pulled from the cellar.  How's that 20 year old lambic drinking?",beer
28,t3_wm4tys,colonkid69420,punk ipa is my favourite beer,That will be all.,beer
29,t3_wl8g5t,FullRollingBoil,"I live in central Illinois and got some negative comments on my Pabst T Shirt. I know the Peoria brewery shut down abruptly in 1982, but does anybody know exactly why?",,beer
30,t3_wl5o6m,Jebediah_Walkeen,why is tavour able to ship beer,"I wanted to order a shipment but i cant understand why they are able to ship beer. WHen i look online in florida, it says shipping is not allowed. Do your beers arrive shaken up? is there any downsides this service? please explain to me. No answer is a dumb answer.",beer
31,t3_wlsj1r,JamesMoore93,Some beers are conflicting!,,beer
32,t3_wles13,Badgerst8,Tree House Brewing,"Finally able to visit Tree House next month, so let's play 3 and 3.  What 3 beers are must haves that they'll have on tap, and best 3 cans to buy to-go?  IPAs only please for this trip.",beer
33,t3_wl26ra,Most_Somewhere_6849,Aging a beer?,"Just picked up a Dogfish head Fruit-Full Fort.  The bottle says ‘ages well’. My question is how does one age a beer?  Is this particular one worth aging?  If so, for how long is it worthwhile?",beer
34,t3_wl29ha,yatwirl,"Magnificent collection of vintage beer advertisement and beer-related art. Literally, thousands of pictures",,beer
35,t3_wka5we,kenflannery,I drank at every brewery in Mississippi in under 24 hours. Not sure this is possible anywhere else.,,beer
36,t3_wkla25,Espresso2YrSkull,Is Spaten Marzen and Spaten Oktoberfest the same beer?,"NOTE I AM REFERRING TO USA SOLD BEERS ONLY
My local tavern has 2 Spatens on draft year round. Spaten Lager (green tap handle) in tap 1 all year long. Tap 2 is Spaten Marzen (red tap handle) most of the year, except around late summer when tap 2 is ""switched"" to Spaten Oktoberfest (blue tap handle) for a couple months.  Is Spaten Oktoberfest a totally different beer than Spaten Marzen or is it the same beer in a different label? My buddy insists they are the same exact beer. I wonder what the difference is, if they are different. Sorry if this is a dumb question, never had them side by side to compare.
BTW I'm in USA",beer
37,t3_wl31yb,VelkyAl,New post on Fuggled...Czeching out Cola Town,,beer
38,t3_wl12i5,WipXL,"beer in aluminum can 'belzebuth' never left my fridge, i forgot it and it has 'expired' on oct. 2021. Is it still safe to drink ?",,beer
39,t3_wk8d8j,eboucher30,bcbs in Chicago,"I'm in Itasca for the week.  Other than the Goose Island brewery, is there anywhere I can get special variants of bcbs right now?   Looking to bring some home.",beer
40,t3_wk5m3i,sambaldwin1982,African/Asian Beers,"Hi. In London for today and tomorrow and am a bit of an avid rare beer fan. Was wondering if anyone knows of places in the capital that sell the following:

Hite Lager (Korean)
Angkor Beer (Cambodian)
St George Lager (Ethiopia)
Chinggis (Mongolian)
Celtia (Tunisia)
Taiwan Premium Beer (Taiwan)
Laurentina Clara (Mozambique)
Mosi Lager (Zambia)
Solibra Boc (Ivory Coast)
Castel Beer (Cameroon)

Or anywhere else outside London too...

Thank you in advance!",beer
41,t3_wl186i,JamesMoore93,Have you ever tried beer and miracle berries?,,beer
42,t3_wkqwqe,Unique-Leading5489,Pivo řezanè,"Anyone had this? It's basically made by layering pale ale and stout to make a beer that is two different layered colours. Actually very nice, didn't taste too stouty.",beer
43,t3_wknair,Trick-Art-2050,Belhaven best alternative,I was in Scotland a few weeks again and had a pint of Belhaven best. I live in Canada and it’s unavailable. I’ve been going through my local supply of Scottish ale and nothing seems to compare. Any suggestions ?,beer
44,t3_wkkf02,Jumpy_Arachnid_7394,Harpoon Farm League similar beers,"A couple years ago Harpoon Brewery put out a mix pack called fantasy league with all low ABV session beers. One of the beers was called Farm League and it was only ever made, as far as I know, as part of that mix pack and I've never seen it since here in Massachusetts.  Does anyone have any recommendations is similar beers or know if it's still available?  Here is a link to description: https://www.harpoonbrewery.com/beer/farm-league/",beer
45,t3_wjjgiz,JJ72891,Dorchester Brewing Company to offer free QA/QC services to local New England breweries transitioning from CO2 to nitrogen,"[Posted on their Facebook page:](https://www.facebook.com/878592165503221/posts/pfbid02pBacsZous6jLm58JnP2UXfbeMGhSHuLWSj6cAmgthhebChaEwtAQfcrNaUwra7Wgl/?d=n)

“It’s just one hit after another - pandemic, aluminum prices, wheat prices, and now CO2 shortages.

With the recent availability issues with CO2 from suppliers across New England, we know that a lot of breweries have moved or are in the process of transitioning as much as possible from CO2 to nitrogen for brewery operations. Since it’s a new process, there are still a lot of questions on how to effectively make the switch without impacting the quality of the beer - especially with respect to oxygen pick-up and DOs in the final product.

To help small and growing breweries in New England during their possible transition to nitrogen, we would like to support, by using our dedicated QA/QC lab, team, and facilities to test your DOs and can seams for free. Our experienced team will take care of testing DOs, doing seam checks (sample screenshots attached), and sending you a QA report.

Why are we doing this? Because we love great beer, and we believe it’s important to be a part of the solution for high-quality execution for our friends and community in New England craft beer.

To take us up on this offer or just to learn more, all you have to do is email info@dorchesterbrewing.com or complete the form on our website (https://www.dorchesterbrewing.com/contact-us/) to get the process going. It’s our way of helping the New England craft community ensure quality, regardless of brewery size.

Cheers,
The Dorchester Brewing Team”",beer
46,t3_wkhyz9,PandaDawg1,Beer Recommendations?,"Hi all,

Ever since turning 21 about 6 months ago I’ve just been exploring and trying tons of beer. I’ve found I love a lot of what Sam Adams has to offer. The cherry wheat, citrus wheat, wicked easy, wicked hazy (I like this one but not as much cuz a lil too bitter for me but still good). 

I’ve also noticed I lean more towards lagers. I really like landshark, banquet, creature comforts classic city lager. Pretty much all lager. Recently though I tried König Ludwig Weissbier and Sam Adams octoberfest, and wow those are great. Especially König Ludwig Weissbier. It’s probably my favorite I’ve ever drank. What should I look for to get beer more like that one? Or if you have any recs from the other stuff I like that’d great, thanks!",beer
47,t3_wkdo0a,Hillbillcwby75,Big ditch hayburner ipa,Looking for a beer like hayburner ipa can't get it in ohio any suggestions will be great thanks,beer
48,t3_wkacyv,shakethatnastybutt,What’s a guy in Philly have to do to find some Rainier?,Help me find the most refreshing beer ever,beer
49,t3_wkfr99,t3m0hpaB,beer yall,"I used to have a DVD of a Documentary called ""Beer Y'all"". it was about a band that travelled North Carolina and played shows. has anyone seen it and could point me to an online version of it?",beer
50,t3_wk81yr,Maleficent_Trade3354,Fosters,On the sesh and bought fosters as the corner shop only had this in large quantities. Anyone who played rugby/football and experienced post game jugs - it’s really not that bad. Anyone else agree?,beer
51,t3_wjt9r6,ecto9000,Shipping beer,"So I’m a Vermonter who made friends with a bartender in the Denver airport who wants me to ship him some heady topper at any cost. Doing some preliminary research shipping beer is actually quite the production. 

Can anybody provide me some guidance on how I can get this guy his double IPA?",beer
52,t3_wjwys9,domingos_vm,Looking for a Spencer Coaster to finish my collection,"Hi to all! I come here on a weird request, and please remove this if it's not correct to post it here. Over the past year, I've been on the quest to try every Trappist beer and have every glass and every coaster. I've right now tasted every non-limited-edition Trappist and have every glass. But, unfortunately, with the closure of the Spencer Brewery (and me living in Europe), it's been impossible to find a Spencer coaster to finish my collection.

Therefore, if someone, anywhere in the world, has a Spencer Brewery that would be willing to sell and ship, I would be incredibly grateful! If you have one of these things, please send me a DM. Thank you so much!",beer
53,t3_wkeak1,schnuck,What’s the point of this sub if I can’t post or link to pics of beer?,"Am I supposed to describe the taste, colour and flavour of a beer?",beer
54,t3_wkbx7z,swzorrilla,"Besides hoppy beer, which other should be refrigerated?","Hello all, 

I’ve been wondering how to stack up my fridge, I know IPAs *need* the most care because of the delicacy of hops. 

But I’ve been wondering if any other style needs attention in this regard? I know doppelbocks and quadrupel will age well. Which styles you normally procure to refrigerate before else? 

Ty!",beer
55,t3_wixydr,Erocdotusa,The Archaic Era of the Beer Growler,,beer
56,t3_wjbusq,VelkyAl,New post on Fuggled...Brewing with Murphy &amp; Rude,,beer
57,t3_witzk7,BobLoblaw_BirdLaw,What’s the best banana / clove “bubblegum” tasting beer?,"I’m not referring to the gimicky banana bread beer or a candy flavor beer. I’m talking something like Weihenstephaner Vitus or Triple karmeliet style, but even moreso. I’ve had majority of the Belgians, triples, and Germans that you’d find in Total Wine. So looking for perhaps for craft beers that also provide this. 

I once had a beer that was perfect. 7-8% abu, but felt like 5%. Not hoppy at all, super floral and flavorful of clove/banana and a bubblegum aftertaste. Was Golden like a triple karmaliet. Sadly I forgot the name. All I remember it was from around the Monterey area (might have been Alvarado but was years ago and don’t see that style in their releases).",beer
58,t3_wiljuv,Jumbo86,Who else loves domestic beer?,"Bud, Coors lite, banquet, Miller lite, MGD, high life, etc. Love it all except Bud light 

I don’t get the hate",beer
59,t3_wizz57,wilburmason,what was your first micro brew,"Curious what your first micro or craft beer was?

Mine was sam Adams cherry wheat (if that counts as one) on draft at a bar.  It was like nothing else I had at the time. 

Before that I had just had the popular mass produced usuals",beer
