,name,author,title,selftext,subreddit
653,t3_v8iu9m,hotelNoiseComplaint,A Plea From German Brewers: Bring Back Your Empties,,beer
654,t3_v9eq9x,rum-77,online beer,Is there somewhere I can order regional beers not available in my area and have them shipped? Specifically I'm in Iowa and would like some yeungling,beer
655,t3_v8vx4y,FroydReddit,Irish craft beer scene,"Heading to Dublin for a week and curious if there's a local beer scene that's worth writing home about or if the macros dominate the scene. Nothing wrong with Guinness of course, but don't want to miss out on notable local heros.",beer
656,t3_v9k0ra,Sullen_Choirboy,"""Cold IPA"" has to be the dumbest beer thing I've heard in a long time.","It's literally just a west coast IPA (the bone dry versions with no caramel malt) with new age, less bitey/resinous hops without the IBU arms race of the Palate Wrecker days. That's it. Anybody claiming its smoother because of the 'cold fermented' technique (not even talking about lager yeast IPLs) should switch their hop bill to the classic dank CCC hops and tell me if you kept the same smooth character. Ridiculous. I need a beer.",beer
657,t3_v8u7j0,Clapperofchain,Sierra Nevada Pale Points,Does anyone know how to redeem Pale Points? I’ve only been able to enter the drawing.,beer
658,t3_v7w9ms,sixthsheik,Welsh man drinks at 56 pubs in 24 hours for Guinness World Record,,beer
659,t3_v8mfvz,AudioMan15,What beer do you like with food?,"When it comes to beer with food I don't like too much flavour (usually a blonde of some kind) around 5%. 
What do you like with food? I'm just curious. Can something like a 7.5% IPA be like a sauce to wash it down or do you prefer something more subtle to let the food do the talking?",beer
660,t3_v8jccd,beer-and-turtles,Germany and Netherlands brewery suggestions,"My wife and I are going to be in Southwest Germany and the a Netherlands (mostly Amsterdam) for two weeks and I’m a huge beer nerd. Europeans and folks who have been over there, what are some can’t-miss breweries?

Cities we will be visiting:
Frankfurt
Heidelberg 
Baden Baden 
Amsterdam 
TBD Netherlands day trips

I like just about every kind of beer. For German stuff I love Schneider Weiss, Rothaus, and tons more. I definitely want to get some good Belgian beers in Amsterdam too. We’re big fans of kreik, gueze, etc

Thanks!",beer
661,t3_v8gbqs,AutoModerator,Throwback Thursday - classic beers and reviews of vintage bottles,"This post has a dual purpose.       

Tell us about classic beers people are still enjoying but not talking about anymore (beers like Duvel, Allagash White, Old Rasputin, etc.).       

Also, post your review of vintage bottles pulled from the cellar.  How's that 20 year old lambic drinking?",beer
662,t3_v8nmmz,prospermediagroup,If you're in the Central KY area here are some breweries you could check out,,beer
663,t3_v88e8p,knightgreider,"Traveling to Belgium, looking for staple breweries we should try.","Does anyone have any suggestions besides the default Delirium and Westmalle Breweries?

Thanks!",beer
664,t3_v7u8ci,JBarchery,What’s your go to cheap light beer for those long hot summer days?,,beer
665,t3_v83fmu,Impossible-Field9945,Beer sales rep tips,I’m new to the industry and looking for tips to boost sales. I’ve been in the service industry for years and my area is bars and restaurants. I really want to do a good job and thought you guys would be a great help. We have an all female sales team and really want to kill it.,beer
666,t3_v8mu2q,Storgasaur,I hate that I can't get a cold beer when I want it (Warm Natty Solutions???),**Does anyone else hate that there's not a way for someone to instantly cool down a can of beer quickly. I understand the cheap tricks of using salt/ ice to cool down a beer but wouldn't it be nicer to have some way to get a can of cold beer instantly?**,beer
667,t3_v85s2m,MsDragonborn24,Everyone talks about Irish beer however what is your favorite Scottish beer?,,beer
668,t3_v7p36t,AutoModerator,No Stupid Questions Wednesday - ask anything about beer,"Do you have questions about beer? We have answers! Post any questions you have about beer here. This can be about serving beer, glassware, brewing, etc.

Please remember to be nice in your responses to questions.  Everyone has to start somewhere.

Also, if you want to chat, [the /r/Beer Discord server](https://discord.gg/MvMVFA4Vu3) is now active, so come say hello.",beer
669,t3_v7x2i5,PD283,Brewer &amp; Celler Person Position at NJ Brewery,"Hey! Never posted on Reddit before, but figured it'd be worth a shot and help some homies out!

Heard NJ Brewery, River horse Brewing Co., in Ewing, NJ is looking to fill some spots in the warehouse. I think they have positions posted on Indeed and ProBrewer at the moment.",beer
670,t3_v83r0y,Successful-Hour413,Where to order specify beers online?,Hi! I want to know if anyone knows if it’s possible to get or order Korean beer online and sent to Texas? I am originally from LA and miss 오비 . Does anyone know if it’s possible to get that in Texas or a website to order it from? Thank you,beer
671,t3_v87w6i,MediciMedicine,Sourcing: Focal Banger in Mountain Western U.S.,"I am trying to track down Focal Banger by The Alchemist for one of my friend's birthday. Being in New Mexico, getting it shipped seems to be the best option. Last year someone recommended Windsor Bottle Shop and they have been OOS every time I have looked. It now looks like they don't carry it anymore. Any ideas on where to track it down? Is there a release date I should be timing? I am planning a trip to Virginia Beach, VA in July and will have some time to visit local shops if that is easier. Are there alternatives I should try?

Side Note: Any recommendations on getting Zonker Stout by Snake River Brewing in New Mexico? Had it just outside Glacier NP and haven't seen it in WY, UT, or NM.",beer
672,t3_v7gybg,Khaos231,"Traveling to GA, looking for local beer recommendations.","I will be traveling to Georgia this weekend and staying about an hour away from Atlanta. I am from NC, so looking to get my hands on some good beers that I can't find at home to enjoy while I am there.

Any styles welcome, you'd be hard pressed to find a style that I don't enjoy in some level or another.",beer
673,t3_v6mkcv,Nex_Skala,Anyone ever had a Fiddlehead IPA?,The title. I just this love this brew. Second best I've ever had (33yo) and fortunately I'm close enough to get them year round. Anyone else ever try one? Thoughts?,beer
674,t3_v764og,hotelNoiseComplaint,Got Mlíko? Why You Should Try a Glass Full of Wet Beer Foam,,beer
675,t3_v7cpj5,FlyingWombatTV,Basic Brewing Guide: What is Beer Made of?,,beer
676,t3_v7d00z,YeetingSlamage,Top 3 Favorite Beers vs Top 3 least Favorite.,"Favorite:

1. Blue Moon

2. Heineken 

3. Corona Extra


Least:

1. Yyengling (or however you spell it the dark one is good though)

2.  Stella Artios

3. Modelo


Honorable mentions for favorites go to:

Rolling Rock, Coors Light and Vienna Lager",beer
677,t3_v66byv,Glass-Ad-2389,For fun: the Dwarfs are hard working stubborn little bastards that fight hard and hold strong oaths. But they hold their beer in higher light. Strong beer that tastes great but will kill mortal men. If you could think of any high alcohol good beer what do you see dwarfs from LOTR drinking?,,beer
678,t3_v69s7f,kalibcr,Bringing beer from Canada to US in a flight - Is it ok in checked luggage?,"Hi guys, I have a flight to the from Canada (Toronto) to USA for a company event and I wanted to bring some local beers so my American colleagues can try a few of our local crafts. I never did that before so I was wondering if it's ok to bring a few cans in my checked luggage for this trip. Anything I should worry about? Do I need to declare this somehow? I'm not talking like 20 beers, maybe 6 - 8 cans is what I had in mind.",beer
679,t3_v7d1td,filthylilbeast,How can anyone drink Michelob Ultra?,It's basically a fancy Bud Ice.  In fact I think Bud Ice I might have more flavor.  If you even think about trying it do yourself a favor and go get a Miller high Life and mix it with water you'll get a better experience.,beer
680,t3_v62zh2,AutoModerator,Monday Morning Quarterback - beer recommendations and recommended beers,"Recommend or ask for beer recommendations.  Did you try anything particularly great this past weekend?  Let us know!  Do you want recommendations based on that beer or others?  Ask away!       

For example, ""I like X beer, what else would I enjoy?"" or ""I drank this Weisse beer, and it was really good.""",beer
681,t3_v5jyfx,HerboSmoker,"Bay Area’s Buffalo Bill’s Brewery, credited for reviving pumpkin ale, shutters after nearly 40 years",,beer
682,t3_v6bdpg,Hipp013,Is it possible to buy the actual European version of European beers in the US? (read more for details),"*For context, when I say ""European"" and ""American"" versions, I don't necessarily mean there are two different formulations; specifically I mean the true original form of the beer you'd find in Europe (e.g. 330ml) vs. the same beer you'd find in America (e.g. 11.2 fl oz).*

---

So a few months ago I traveled to Brussels, and while I was there I fell in love with a little lady named [Delirium Tremens](https://www.delirium.be/themes/custom/delirium/assets/img/beers/beer_delirium_tremens.png). In my opinion it's got the perfect balance of sweet, bitter and carbonation that makes it ideal for any occasion. I bought two 4-packs and brought them home to the US with me, and since those ran out I've been able to find them at various liquor stores here in the States. 

The problem is, like with many imported European beers I've tried, I've found that the ""American"" version is much more carbonated than the true European version. My thought is either this has to do with needing to preserve the beer's original taste over the longer distance and time necessary for importing, or it's a result of the beer being stored for longer over that duration. Regardless, I much prefer the original carbonation factor of the true European version. (If I had to describe the difference in layman's terms, the carbonation in the European version feels much more ""foamy"", as in the bubbles physically feel smaller and more dispersed across the tongue, whereas the carbonation in the American imported version feels much more ""fizzy"", i.e. the carbonation feels more sharp and overpowering.)

&amp;nbsp;

So I actually have two questions, one general and one specific:

1. General question: Is there an actual difference in the carbonation between European beers and those same beers that are imported to America? If so, what is the reason for this?

2. Specific question: Is there a way American consumers can purchase the true original European version of imported European beers (i.e. volume denoted by ml instead of fl oz)? And I don't mean in terms of specific stores, but more-so does the ability exist?


I know of several places like World Market that specialize in imported goods, and imported beers sold at those places may or may not be denoted in ml instead of fl oz, but I am not sure if the difference in carbonation in the European vs. American versions is due to differences in the ways the beers are actually produced, or if it has to do with the fact that the beer is imported and inherently sits in storage/transportation for longer, causing the carbonation to change. In other words, if the difference is due to the latter, then maybe there would be no difference in taste between the 330ml and 11.2 fl oz versions simply due to the fact that both had to spend additional time in transit to the US.

 
Thank you!",beer
683,t3_v6mnn5,LayneCobain04052002,Blue moon abv...,"I always thought blue moon had 7% alcohol, apparently everywhere I look on the internet now it says 5.4%. Did they change the abv? Was it ever 7%? Am I insane?",beer
684,t3_v5uya8,TheEggManComes,Favorite beer is Sam Adams Cold Snap; Is there anything similar for around the same price range?,"Hey guys!

&amp;#x200B;

So I'm a Massachusetts native and the beer which got me into beer was Sam Adams Cold Snap. I always try to pick up as much as I can during the winter as I haven't really found anything else which tastes like it. Is there anything somewhat mainstream that has a similar flavor? I'm still a college student so more often than not I'm still drinking Narragansett or pabst, but I love ""splurging"" for nights where I'm not trying to reset any of the education I've received or throw up in the shower.

&amp;#x200B;

This is my first post to this sub so I apologize if it's ill-formatted. Thanks for the help!

&amp;#x200B;

EDIT: I would like to add that I've just started enjoying more complex flavors as well. I'm lucky enough to be right next to the town which has Treehouse Brewing Company in it, and I think my taste finally developed to enjoy the bitterness of many east coast brews. So although my go-to are the gas-station specials (woo-hoo college), I've started to really enjoy the more specialized stuff!",beer
685,t3_v5dhb1,Codydog85,"Does anyone read beer magazines, and if so which ones","I was looking online and saw a number of beer magazines:  Brew, Beer and Brewing, All About Beer, Beer Connoisseur.  Just wondering you all read any of these and do you prefer one over the others",beer
686,t3_v5tf5d,Allium_Sauron,Best beer for someone new to it.,Not a beer fan most of just does not taste good at all but I haven't really tried any besides an IPA at a local pizza place. What's a good beer to try for someone who doesn't know. I usually drink whiskey but wanting to try different things.,beer
687,t3_v5vlpy,[deleted],"I'm turning 19 in a few days, what beers should I get?","So I am turning 19 (age of majority in Canada) on June 11th and I would like some suggestions for some beers to try. I haven't experienced anything other than sours, imports seem like they could be cool.",beer
688,t3_v5qdbz,killakyle1762,What are the do's and don'ts of drinking at the beach?,,beer
689,t3_v5pkw9,Boudreau_428,Rush Canadian Golden Ale,"I'm a huge Rush fan and to my delight I found a couple cans at my local Beer Store, haven't tried any yet but would like your guys' input on how it'll taste if any of you have had it before, thanks.",beer
690,t3_v5jy5a,thekatedepression,Outback Steakhouse Bloomin’ Blonde Ale,"Does anyone know of a similar beer? It’s my husband’s favorite, but it’s specific to Outback.",beer
691,t3_v51bwp,AsslessChapsss,Gel like beer,Can someone explain why a beer would feel like gel? I opened a coors light and it has the viscosity of gel. Tasted like shit too. Never in my life have I opened a beer like this,beer
692,t3_v4t5pf,AssCumBoi,What's your favorite European beer and what did it taste like?,,beer
693,t3_v5lgcr,rileydogdad1,Worst Beers,"Usually I don't agree with these lists but this looks reasonable.

&amp;#x200B;

[https://www.eatthis.com/news-worst-beers-in-the-world/](https://www.eatthis.com/news-worst-beers-in-the-world/)",beer
694,t3_v55vzt,lenaluuuu97,Trying to find a specific beer for this guy I’m dating,"I started dating this guy last week and he told me about a beer he had once in Colorado that he loved! It was made with the prickly pear on a cactus and he said it was insanely smooth. I checked numerous liquor stores and wine, beer, and spirits stores near me but no luck. 

I’m guessing this beer might only be available in Colorado. I think it might be the Perilous Prickly Pear but I’m not 100% sure. I’d like to surprise this guy with the beer so if anyone can help me and let me know if they still make this beer in CO? Or any recommendations for a similar tasting beer in CA? Thank you!",beer
695,t3_v4pasc,[deleted],Tokyo Craft Beer Bars?,Can anyone recommend some interesting craft beer bars in Tokyo?,beer
696,t3_v52x2z,cjbrazdaz,Any microbiologist/biochemists that can give job advice to a grad?,"I’ll soon be a double master’s graduate in biochemistry. I’m interested in working in the breweries and am a trained microbiologist. I’m wanting to get into the breweries but do not know where to begin. Is there any job title/role I should keep an eye out for? Any advice? Thank you!

I’m also a homebrewer of beer and kombucha. Is it good to use this in a resume or interview, or does it make me look cringey?",beer
697,t3_v4xj94,saltygirl0401,0.0 options?,"Hi there! Not sure if this has been posted about or not before, but I’m wondering if anyone knows of any non-alcoholic beer options that are 0.0 alcohol content other then Heineken? My partner is sober and was super grateful when Heineken created theirs, but he’s wishing there was a bit more variety. Any suggestions?",beer
698,t3_v4si76,toastnosauce,"Any good places for craft beer in Bahrain, if that even exists?",,beer
699,t3_v4w0p2,JimP3456,Allagash Seconds to Summer Lager ?,"Anyone whos had it, what beer does it compare to ?",beer
700,t3_v4vyfk,[deleted],Brussels Beer Project Fans?,,beer
701,t3_v534u9,KegalsInTheOlypmics,"I’m traveling around Greece for a month, any beer or brewery must try’s?",The title says it all! Let me know any recommendations if you have them! I have been to many breweries around Europe before and I always enjoy trying new beer.,beer
702,t3_v4vdex,Ernesto593,Best craft beer bars in Los Angeles?,,beer
703,t3_v4xmbm,Aggravating-Pear4222,Yeasty Beers,"Anyone know some good very yeasty beers? I want to get some for a friend who says she orders the ""yeastiest"" beer when she goes out but that it's never yeasty enough. Any suggestions? Thank you.",beer
704,t3_v55xlz,finmagoo,I am hoping for help here in locating a discontinued beer,"My best friend loves beer. He brews his own and drinks all different kinds (and teaches me all about it bc I am allergic to hops and love the smell and the tastes but get really sick if I actually drink it). The man literally is amazing and does everything for everyone, but nothing for himself. Offhand, he mentioned that his favorite beer ever was Dragon's Milk Reserve Coconut banana. I think to myself, great, I will get it for him as a gift for Father's Day. Nope it's discontinued and virtually impossible to find. I did find a place in Tennessee, but I'm in Pennsylvania and they don't ship because of state laws. Im just wondering if anyone has any guidance or knows of any online places I might be able to find this. I appreciate any and all suggestions (including any other beers that might be comparable if this is a bust). I read the rules for this sub and I'm hoping that this doesn't break any, but obviously mods please remove if this isn't allowed for any reason. Thank you all so much!",beer
705,t3_v49kmm,Corn1989,What’s brewery you wish you can try but they don’t distribute in your area?,"For me it’ll have to be ex-novo, tripping animals and monkish!",beer
706,t3_v49umc,degggendorf,"Looking for Chicago brewery recommendation; good beer, laid back atmosphere","We're staying by Midway, but location doesn't really matter - taking orange in to green is  fine by us. But I'd really like it to be a chill spot to hang out, don't want to have to like elbow my way in to the bar to shout an order in.

Good beer, ofc. Bonus points if there are multiple within walking distance, which looks like might be the case around the green line Kedzie stop?

Thanks!",beer
707,t3_v4tvno,slidegorl,Keg help,Hello! I have never bought a keg and would like suggestions on the best keg size and beer to get. The party will be around 40 people. Thanks :),beer
708,t3_v4tcac,theblazingkoala,hello beer enthusiasts! I need recs for Maine beers!,"Hello! My family lives in Maine, near Presque Isle/Caribou and I am going to visit them for a week. 

Beer drinkers of Maine, which breweries might be in the area worth trying? Or Maine beers that I could get at a store there? 

Bonus: I am already aware Allagash Brewery is in Portland and actually have planned to visit it on the way back home! 

Thank you!",beer
709,t3_v4tb9h,Aud_clark,Help me find a beer I once had that tasted like liquid bread,"Years ago in either Seattle or Portland I went to a casual restaurant and ordered a cheap beer. Pardon my lack of beer knowledge and terminology but it was some kind of wheat beer I think, and it tasted like bread in a can, one of the most bready beers I've ever had. Not hoppy, very smooth, yeasty aftertaste. I think the can had a picture of a little boy on it and I remember the color blue on the can?

I have no idea if this was a beer local to the area but I have not been able to find it. If this sounds familiar, would love any leads!",beer
710,t3_v4fhr7,MsDragonborn24,What is your most favorite chocolate forward stout?,"I love Guinness for its chocolatey and coffee notes, however I’m looking for something that can cure my sweet tooth lol.",beer
711,t3_v4536k,ritstyx,Can't-Miss Beers to Try at the Firestone Walker Invitational,,beer
712,t3_v3yvka,AutoModerator,Free Talk Friday - /r/beer chat time,"Thread shitting is encouraged! Have fun, talk about your weekend plans, let us know what you will be drinking. Post pictures and memes.

/r/Beer chat has moved from the abandoned IRC channel to [our official Discord server](https://discord.gg/MvMVFA4Vu3).  So, come say hello.",beer
713,t3_v4b7ca,Sisko_of_Nine,Charlottesville VA recommendations?,Thanks in advance!!,beer
714,t3_v4dk3j,5_Frog_Margin,Maybe the most fantastically-named beer I have ever seen.,"I drove up from Baltimore to Harrisburg to attend a punk rock show (Total Chaos/Cro-Mags/Exploited) 2 weekends ago. We stopped off at ZeroDay brewery to check out their craft beers. They were all pretty decent, but they had the most fantastically-named beer I have ever seen. It was a Wheat Beer called ['When Did We Get A Dog?](https://untappd.com/b/zeroday-brewing-co-when-did-we-get-a-dog/2299425). 

It wasn't bad. Mild with hints of fruit flavor. Still, we need better names for our beer.",beer
715,t3_v4h5rt,ismoke21000,"Bought a house and a keg was left in the garage. Top rim next to handle has one dent in it, not to big but noticeable. Is it considered damaged or can I use it for a deposit for a house warming party?",,beer
716,t3_v45xfg,techn0mad,Any Pliny the Elder to be found in Salem/Portland?,"Does anyone know of any vendors in northern Oregon who actually have Pliny the Elder in stock? Passing through on our way back to WA and hoping to grab some on the way by.

Thanks!",beer
717,t3_v47kxm,I_am_Indecisive_,sweet beer with few/no hops,"In Canada, looking for a sweet beer with few or no hops. For reference, I like pretty sweet drinks, for instance smirnoff ice. Don't really have any beers I already like",beer
718,t3_v3f20y,drak0bsidian,"PODCAST: In ancient Israel, a woman's place was in the home making beer",,beer
719,t3_v3qlpi,floyd769,Must visit breweries in Indianapolis?,Looking for recommendations on best breweries to hit up in the Indianapolis area on a 2 day trip.  Any help is appreciated.,beer
720,t3_v369c4,sheerapple123,"Best Breweries in Portland, ME?","Going to Portland in a few weeks with some buddies and looking to try some good local spots! For reference I love hazy, juicy NE IPAs. My buddies are more on the lager/Pilsner side but like IPAs as well. Thanks!",beer
721,t3_v3p763,dar482,"Best Bottleshop in Portland, OR?","My wife is going to Salem/Portland. Shes willing to ship me a box of beer.

Any recommendations on Bottleshop and beers? I definitely want some Breakside IPAs, de Garde. We recently got some Great Notion come into town (Orlando). Otherwise, not much local Portland stuff comes down here.",beer
722,t3_v30snj,Krispy_Minty_3,Schlitz Beer,"Hey so I’m from one of the southern states. Is there a state out there that still has Schlitz beer? My grandpa use to drink it, and it was the first beer I ever had. I wanna remember him and remembered the first beer I ever had.",beer
723,t3_v3ffb1,Naive_Emphasis9477,Keg Questions," 

How long would it take to chill a 1/6 keg from room temp (72) with ice/water in a garbage can? What is my ideal beer temperature to enjoy an IPA by the pool?

Can 2 1/6 kegs fit into a large garbage can?

Thanks! -Inexperienced Keg Buyer",beer
724,t3_v3l2qh,crazymoon,Weird redhair looking growths on the inside of bottle caps,Buddy and I got a 24 of sleeman and noticed after drinking a majority thats there's these small red looking vine looking things growing from along the edges of the cap. Is it rust or like a mould? Anyone else encounter this with beer?,beer
725,t3_v38c4a,AutoModerator,Throwback Thursday - classic beers and reviews of vintage bottles,"This post has a dual purpose.       

Tell us about classic beers people are still enjoying but not talking about anymore (beers like Duvel, Allagash White, Old Rasputin, etc.).       

Also, post your review of vintage bottles pulled from the cellar.  How's that 20 year old lambic drinking?",beer
726,t3_v2sv60,yopinbo,What happened to Notch Infinite Jest?,I loved this beer and it sounded like so did everyone else. I thought it would be seasonal and waited for the summer time for it to show up again. Alas they stopped producing it. What a shame. Anyone know why?,beer
727,t3_v2jbod,Wernher_VonKerman,Jack’s Abby in Colorado?,"One of my liquor stores that I go to has a “fancy beer” shelf for single bottles of rare and expensive stuff. One of these was a Jack’s Abby Framinghammer. The thing is, their beer finder implies that they don’t distribute anywhere to the west of Pennsylvania, and certainly not to Colorado. Is this some kind of one-time distro? And why would it be just the one beer?",beer
