,name,author,title,selftext,subreddit
461,t3_vo7t99,AutoModerator,Throwback Thursday - classic beers and reviews of vintage bottles,"This post has a dual purpose.       

Tell us about classic beers people are still enjoying but not talking about anymore (beers like Duvel, Allagash White, Old Rasputin, etc.).       

Also, post your review of vintage bottles pulled from the cellar.  How's that 20 year old lambic drinking?",beer
462,t3_vopo2a,iheartpgh,"Meet the CTO (Chief Tasting Officer) of Busch's dog beer (yes, a beer for dogs)",,beer
463,t3_voi3fu,random_chance_questi,"Alcohol intolerant, drank non alcoholic beer and felt terrible the next day. Anyone know why?","Figured I’d ask the beer experts. As title says, I’m intolerant to alcohol, and consistently feel terrible after non alcoholic beer. The type I’ve been having does have a SG warning on it, saying it has less than .5 percent",beer
464,t3_vnknij,punifu,beer tasting order,"is this a good order to taste these beer styles?

&amp;#x200B;

european pale lager

wheat

belgian PALES ales(blond, strong ale, tripel)

belgian DARK ales(strong dark, dubbel, quad)

porter, stout, imperial stout

irish stout, tropical stout, bock

(IPAs) pale ales 

&amp;#x200B;

i made a post a month ago, and i've rearranged some of it but would like some help from you guys

    Hello guys im currently working on a beertasting day on my local beer shop, since im not an expert and my stock is limited to some styles i tough of:
    
    7 categories (styles) each one with 3 different beers",beer
465,t3_vo1rnu,Mastodon-Educational,Love sour monkeys - what other sour beers should I try?,"Tried sour monkeys for the first time the other day and thought they were really good. Also liked the ABV because didn’t have to consume as much liquid to get a buzz. Any recommendations for other beers like that to try? Preferably things you can find in the supermarket or liquor stores

Edit — live in Honolulu",beer
466,t3_vnzfz7,Not-OP-But-,I enjoy the Guilty Pleasures beers by Wicked Weed. Anyone here know of anything similar to try?,"It's like a dessert beer. They are ~8-13%, they have a barrel aged version. They're things like chocolatey cake beers basically or things like Espresso or Cookies.

They can be overly sweet, but I like to pair them with darker stronger cigars so it works well.

I don't mind too much if its 4% or 12%, I mostly enjoy the flavor and texture.

Any similar beers that are sweet and chocolatey?

I also like Sweet Baby Jesus/Java.

I'm in NE Florida.",beer
467,t3_vnviuk,Biblehuggerz98,Any great recommendations for breweries in Salt Lake City,Going there for the first time. and I wanna go where all the Morman sinners go for a nice glass,beer
468,t3_vnrau8,Creative-Cry2979,Paradox brewery,Anyone ever try it? On vacation in the ADKs this week and have been told to visit the brewery.,beer
469,t3_vnizsz,repetezsilvousplait3,"Looking for something dry, nutty, and light","I will say that when I first got into beer, over ten years ago, it was (English) brown ales that opened the door. Also common and enjoyable were those like Rogue Dead Guy Ale, Firestone Walker DBA, Alaskan Amber, and Anchor Steam. More recently, those up in ABV, like The Hairy Eyeball and Fire &amp; Eisbock, have also been revelations for me. 

When I analyzed some of my favorites, descriptors like ""dry"", ""nutty"" and ""light"" often came up. I could easily stick to those styles listed above, but also know that even within the same categories, you can get very different results (for example, I loved Boont Amber Ale, but wasn't impressed with Ruedrich's Red Seal Ale; too sweet for my liking). 

No idea if its the same nationwide (or globally), but some of the old standbys have become increasingly harder to come by. The shelves are dominated by hazies, seltzers and other ""malternatives"". Thank God imports are still a thing! So, I am asking for suggestions. Who knows? Maybe I'll come across something I would normally overlook and be pleasantly surprised.",beer
470,t3_vmwg4d,PDXEng,Portland's Hair of the Dog closing,,beer
471,t3_vnf9ct,AutoModerator,No Stupid Questions Wednesday - ask anything about beer,"Do you have questions about beer? We have answers! Post any questions you have about beer here. This can be about serving beer, glassware, brewing, etc.

Please remember to be nice in your responses to questions.  Everyone has to start somewhere.

Also, if you want to chat, [the /r/Beer Discord server](https://discord.gg/MvMVFA4Vu3) is now active, so come say hello.",beer
472,t3_voaoz5,chamou1190,Are pale ale real ?,"I don’t understand exactly what place pale ale occupy in the beer family. I mean you can ordre IPA, APA, amber ale and various other ales which are from my understanding a subset of pale ale family. But does it make sens to order a pale ale ? Should you precise what kind of pale ale you want or does it exist on its own ?

Edit : I understand I can order something labeled as Pale Ale but is it taxonomy wise correct or is it just a marketing label meant to simplify things for consumers . Said differently if I buy a beer labeled Pale ale am I in fact buying something more precise as an English pale ale, apa, ipa etc. Or might it be a just plain pale ale ?",beer
473,t3_vnoo68,Independent_Ad3705,"Beamish Irish Stout, Where The Hell Is It?","I was told Beamish is a must try, but I cannot find it in the US. I have looked everything just short of the deep web. Any ideas? Thanks in advance!",beer
474,t3_vnmlq8,VelkyAl,New post on Fuggled...The Genius of Marketing,,beer
475,t3_vneir1,BoyMeetsWort,"A few reflections on Jamil Zainasheff &amp; Heretic Brewing parting ways. Was this a smart move by Hereti? Or will this come back to bite them? Either way, can't wait to see what's next for JZ.",,beer
476,t3_vn0xkb,zAAAAAAAAAAAHHHHH,Looking for a very specific brewery recommendation for Portland Maine,Can anybody recommend a Portland Maine brewery with good food and good ciders or mixed drinks. (My Fiancé doesn’t like beer),beer
477,t3_vnhbyu,YeetAway900,Can I safely use a beer Stein for drinking cocktails too?,"Hey guys. I figure this is the best place to ask this question. I recently got a German beer Stein made of clay with the pewter and everything and I really like it. I want to use it for decor as well as drinking beer. Additionally, I was wondering if it is safe to put a cold cocktail in there as well? I’m worried about citrus, juices, mint leaves, etc. staining or ruining the inside of the Stein and don’t want to risk it if I’m unsure. Do you guys know if is safe to do? Hope this isn’t too blasphemous haha.",beer
478,t3_vn2slz,Solid-Snenk,Recommendations for a substitute,"I am located in the Coachella Valley and I’ve been finding it hard to locate Firestone Walker’s FlyJack IPA in my local stores, I miss the taste of it so much but I doubt I will see it back on my shelves soon. Can anyone recommend me something that might be its equivalent in its light, citrusy, crispy goodness.",beer
479,t3_vm9wnt,Tiger217,Where does “flight delay airport beer” rank in the beer pantheon?,,beer
480,t3_vnd73r,duncthefunk78,Anyone listening to the Brewdog podcast on BBC Sounds?,,beer
481,t3_vmg1al,macadellica,Belgian Beers,"I’ve been studying in Belgium for several months now and it’s safe to say I’ve tried a fair amount of beer here. I believe I’ve checked off most criteria to try (triple blondes, Lambics, darks, etc). 

I want to know everyone’s favorite Belgian beer since I leave here in a month or two, and want to try some I haven’t heard of. The more data I can collect the better ;). 

Cheers.",beer
482,t3_vlzxs6,bluefishredsea,What price are you paying for a pint these days?,I work at a bar. We increased our prices over the weekend to $3.50 for a pint of domestic. I’m in rural MS so COL is low. My regulars are going to have something to say (because that’s what they do but I’m used to it). I just want to give them an idea of what people pay across the country so they will hopefully not drag the conversation out all night.,beer
483,t3_vmxecb,IntoTheWild_,Companies with patriotic cans/bottles?,Has any one seen any patriotic beer cans or bottles for the 4th of July? I've only seen miller with a flag but I'm looking for a variety. TIA!,beer
484,t3_vma0xe,Brewer1056,"Visiting Framingham, Mass. What's the best beer store around here, of course looking for Trillium and Tree House. Tried Jack's Abby last night, great food and solid beers.",,beer
485,t3_vlz2ai,Iloveburpees,Roadtrip Brewery Recommendations,"Taking a ride from NY to Chicago and later down to Florida and back this summer, any recommendations on must-see breweries along the way?  

Some major stops include: Chicago, Durham NC, Bluffton SC, Miami, Tampa, Orlando, Myrtle Beach, and DC.

Edit:  Thank you everyone for your recommendations!  I've put together my google map for quick reference as we travel, can't wait to visit these 
https://goo.gl/maps/B8nrkjLqx9R69Lmj8",beer
486,t3_vmaxfc,eatasssnotgrass,Has anyone tried Mother Earth brewing or Sockeye brewing?,"I seen a 6 of Milk Truck milk stout from Mother Earth and Powerhouse porter from Sockeye

Just wondering if anyones tried either of those beer brewed in Idaho? Looked good and I'm a fan of stouts and porters",beer
487,t3_vmaxbb,Youvitiva,First All Grain Brew is in the fermenter,"Did my first all grain brew today. I did a Verdant IPA recipe by David Heath that I converted into normal measurements , substituted a couple of grains that he used that I couldn't get at my LHBS, and upped the hops amounts minimally.  


I used my new Brewzilla 3.1.1 and am favorably impressed with it's operation. I set it up last night to come on at 530 this morning to begin heating the strike water to 156. When I got up at 6, it was already at 120, so I switched it to manual from there on. Around 630, I began to mash in. It really felt weird to me stirring the grains, especially the ones at the bottom where they were thick, but I had never done it before and had no idea what it should feel like. After a few minutes of stirring, chopping motions (up and down) with the paddle, and using the paddle like a shovel to lift grains from the bottom to the top, I felt I should be good to go. I did stir in three handfuls of rice hulls, just in case, as there was 1.5 pounds of oats in the grist. I was unable to check the mash PH, as my wife's PH meter that she used to use for making cheese decided to not work today. Brewfather was pretty much right on with all the rest of it's calculations, and it calculated my to be 5.49, so as long as that is close, I should be OK. I set the temp to maintain the 149 degree temperature and then I put the top plate in place and started the recirculation for the mash. At first, I tried to keep the water level low on the top plate, but after 10 minutes or so I thought I should turn the pump up a bit and raise the level because by my logic (could be totally wrong, IDK), having a higher wort level on the top plate would exert a little more downward force, resulting in the little bit higher flow through the grain bed. All went well for the remainder of the mash. At the end of the 60 minutes, I raised the temperature to 170 for mashout. I forgot to measure how long the BZ took to get there, but it wasn't long. During the mash, I had heated my sparge water in the kitchen using the kettle I had been using for extract brewing. I was concerned about lifting the mash pipe out due to the weight on my extremely f'ed up shoulders, but not to worry it was actually easy to lift out. It drained quickly, and the entire sparge (only 2 gallons) only took like 5 minutes. I removed the malt pipe and put it in a clean food grade bucket, not expected the roughly one quart of wort that drained into there (I thought it was finished). Not a problem, it was a clean bucket, so into the kettle it went. Pre-boil gravity was 1.044 when it should have been 1.046. I'll take it. Raising the temp to a boil took a bit, but not overly long. There was a small amount of grain particulate in the wort, but really not very much. The BZ got the wort to a pretty decent boil, not violent, but pretty good, about right where I would try to set my extract batches. I put 10 drops of fermcap s in right before the start of the boil, and the hot break was a total non issue. The boil and additions were totally textbook, no problems. 10 minutes before the end of the boil, I put on the whirlpool arm and put the chiller in to sanitize them. I used a inexpensive pond pump off of amazon in a bucket of ice water to chill. I was supposed to be using a cooler instead, but the cooler was leaking (it's been years since it has been used for anything other than to keep smoked pork butts hot while they rest after cooking). Cooling down to the hop stand temperature took only a couple of minutes. I turned off the chiller and left the whirlpool running for the hop stand, then fired up the chiller again to further cool. I forgot to take off the blanket and I'm sure that hurt my cooling a bit, note to self for next time, but I was only able to cool to about 105 before I was totally out of ice....oh well, I just put it into the fermenter and into the mini-fridge at 60 degrees to further chill to pitch temperature. After I was done chilling as much as I could, I carefully removed the chiller, then whirlpooled for another 5 minutes, then let it settle for 10 to try to get the hop sludge to cone up on the false bottom. Quantity to fermenter was 5.20 and OG was 1.050 (supposed to be 1.052). Again, I'll take it. I used the pump to put the wort into the fermenter and I placed a sanitized 200 micron paint strainer bag in my fermenter bucket because I wanted to see how much crap got past the false bottom and into the fermenter. I had intended to take a picture of it, but there was nothing to take a picture of. I am TOTALLY impressed with the false bottom in the BZ.  


Lessons learned:

  
1. Check/be aware of equipment statuses before brew day (Ph meter and cooler)  
2. I need better tubing for my chiller. What I have is thin walled silicone and it kinks/flattens out way to easy, obstructing flow.  
3. I harvest ice from my fridges ice maker and put it in a plastic bag, then store it in the porch freezer until needed. I need to harvest more and will also be freezing a \*\*\*\* ton of cool/freeze packs that I have to add as well. Will be buying another cooler which will give more volume for ice water as well. Don't know if I'll be able to reach pitch temp or not (of course, by the time I was chilling, it was close to 100 ambient temperature, so there is that.",beer
488,t3_vm0c72,TA135713,help with identifying polish beer,"I just visited poland, gdansk. Where I drank a delicious dark beer. 
It tastet quite like guiness, but with alot of carbon. 
Or like a stout, without that thick sweetness. Just lots of carbon.
Since everything was in polish I don't know what it was. I wonder if it was a dark belgian or something? anyone knows?",beer
489,t3_vluygh,AutoModerator,Monday Morning Quarterback - beer recommendations and recommended beers,"Recommend or ask for beer recommendations.  Did you try anything particularly great this past weekend?  Let us know!  Do you want recommendations based on that beer or others?  Ask away!       

For example, ""I like X beer, what else would I enjoy?"" or ""I drank this Weisse beer, and it was really good.""",beer
490,t3_vlipll,bbbbbbrainblast,Why is it so easy to down multiple beers but not soda?,I can drink 5-10 beers in an hour or two easy but theres no way I can drink more than 2-3 sodas in that same time frame. Any idea why? Beer just goes down so fast for me and I dont feel bloated like soda makes me.,beer
491,t3_vmatcr,Eight_n_Sand,Short Pours,Just a quick question for y’all. I ordered a couple pints at like 3 different US bars over the past few weeks and felt ripped off at all of them due to the bartenders not even trying to properly fill the glasses. Is this a new thing? I used to go out quite a bit  and I don’t remember having this problem in the past.,beer
492,t3_vm6qdd,pwesten,Heading down to Raleigh NC,Going down to Raleigh in a few weeks and wondering what places there are in the city to check out,beer
493,t3_vle45z,Giallo_submarine,"Bought a ton of slightly out of date Oktoberfest beers - what to expect, taste-wise?","Found a store online which clearly overbought on 2021 marzen from the Big Six. £1 per beer - too good to pass up, and I bought ehh... a lot.

Most are between 1 and 3 months out of date, so not too bad. However, I'm starting to wonder if I've shot myself in the foot. I've aged strong beers for years past their date, but never anything in the high 5% range like marzens.

What are the chances they'll have lost a significant portion of their carbonation and taste?",beer
494,t3_vl79zt,ConestogaCreek,Pacifico Clara - 1st time,"I tried Pacifico Clara for the first time last night and really like it. To me it had a lot of flavor but still nice and light. I love Mexican beer in the summer!  Pacifico gets horrible reviews on-line and not that I care but I can’t help but wonder why the hate?  
PS - it was someone in this Reddit that recommended it to me on a post I did last week so thanks!",beer
495,t3_vleshx,thathaitianguy,"I get to interview a local brewmaster tomorrow for a YouTube series where a document different professions. If anyone in the group is a brewmaster, “what are the realities of his job that you wish people or the general public knew about“.","As the title says tomorrow I get the chance to interview a brewmaster at a local establishment in my town. I have some general questions lined up that I want to ask him, but at the same time want to have a free-flowing interview and one of the questions I wanted to ask him is, “the realities of his job that he wish people or the general public knew about“.
 I wanted to ask you guys your opinion on the same question.",beer
496,t3_vljx84,John314636,How many of you have acid reflux or Eosinophilic Esophagitis from drinking?,I love a couple cold ones! I love trying new stuff but developed Eosinophilic Esophagitis.,beer
497,t3_vlpnrm,swoipy,I will open liquor shop in Korea. Any one recommend me?," 

I will open liquor shop in Korea.

So I want to know what is the most popular globally.

Anyone recommend me the list of you guys want to get.

I will check you guys suggestion and update my selling list.

Thank you for your concern",beer
498,t3_vkjazu,Ofbatman,Does anyone really care about Sapporo buying Stone Brewing?,,beer
499,t3_vlmon6,kdkv,Beer podcasters/youtubers who burp a lot? Need to test my burp detection machine learning model on audio sample," I whipped up something with Keras to detect burp in streaming media as a side project for online class, and I wonder if there are any good beertubers or podcasters who burp a lot so I can test my model on different types of burp and background audio/voices. Perhaps the model can be eventually used to edit them out if you don’t catch the burps beforehand. TYIA and happy beer day :)",beer
500,t3_vloc54,Wizard_Fist801,I drink 6-10 beers a day and love it. Will my health really suffer?,"So I’m just going to come out and say that I absolutely love beer, light beer, craft brewing, Mexican beer, I love it all. I usually stick to light beer due to the calories. I also enjoy the way I feel when I drink beer. I’m a naturally anxious person and although I’ve sought medical help, I just find that beer works better for me than medication and I’m generally happier. I try not to binge, usually just start after 5 and pace myself until I fall asleep. I’m productive, active, and take care of my family. I don’t want anyone to try and justify heavy drinking I just am curious to hear peoples thoughts and if anyone feels the same. Appreciate any insight, thank you.",beer
501,t3_vkv08q,aznburn,Does just having one or even two drinks of beer affect sleep?,"

I know drinking alcohol does affect sleep but all the studies that are done are usually people that drink more than 3 drinks of alcohol. I was curious if even one or even two beers affects your sleep quality in the same way? Where it disturbs REM sleep and muscle recovery? Is it really that bad if i just drink one beer before sleeping",beer
502,t3_vlkobz,bkedsmkr,PSA: Salt your rims,Almost all mexican lagers greatly benefit from a bit of salt on the rim of the glass. Had a Bohemian this way and it's a must for me now.,beer
503,t3_vl4226,PhotoslotTV,23 Brewing Brett Tieman discussing the new Pale Stout 啤酒談話 Taiwan and h...,,beer
504,t3_vkxzub,notdarryloftheoffice,Looking for beer salesman advice*,"Just got hired on as a beer salesman, I have no actual experience in field so would appreciate some advice if possible? Secondly they offered to start me out at $10/hr + 13% total sales/commission that feels low what's the normal going rate? Anything helps cheers!",beer
505,t3_vkr1ii,rjcuple33tryattrying,Best Scottish Ale?,What's your favorite Scottish Ale? And has anyone ever heard of a Scottish Red ale?,beer
506,t3_vkvjr5,BenKlesc,Why does beer make me more anxious?,"I don't know what it is.

I love the taste of beer, but instead of making me relaxed, it tenses me up.

Even after just a tall glass. I will go from having effortless conversation, to overthinking everything I'm saying, and just getting more nervous.

I feel like I'm losing control, and I just get super stressed about that. I'm the same way with weed which is why I never touched drugs like marijuana.

I'm the guy that turns into the mean drunk. Is there a way I can reverse this, so beer makes me relaxed instead of anxious and angry and stiff?

I almost feel like having just one glass of beer isn't enough, and I hate being half buzzed and half sober.

I almost like liquors a lot better that get me drunk faster. I feel like I cannot relax unless I'm totally drunk.",beer
507,t3_vkmqo1,Juicecalculator,We are visiting Gatlinburg Tennessee for a week. Are there any breweries/beers you would recommend?,,beer
508,t3_vkj587,TYScycler,Toronto? Best Brewery to visit?,,beer
509,t3_vknggt,caret6,Prestige needs some respect,"It’s a Haitian brand that Heineken is currently brewing in The Netherlands and distributing to the U.S. It’s bottled in brown stub bottles (exactly like Coors Banquet) and has a red/blue/yellow logo.  It can be found it at Total Wines and my local family owned superstore also stocks it.

For some reason, I always find myself coming back to this lager as my daily, especially when I’m mowing the lawn or grilling.  

It’s objectively nothing special but a frosted Prestige just hits me different, does anyone else enjoy this delicacy?",beer
510,t3_vkm4e3,macready71,Lagunitas and Newcastle,"Asking on the off chance someone has info. Here in central Florida, in my county at least, Newcastle is out of stock for the last two months. The liquor stores say they don't know whats going on.

I've used the contact thing on Lagunitas website and don't get any response there.

Have they stopped making it?",beer
511,t3_vjilo5,twoodfin,Sapporo USA to acquire Stone Brewing,,beer
