,name,author,title,selftext,subreddit
252,t3_w4a4j3,Stauce52,"Can a Belgian ale still be a ""trappist"" beer (e.g., Dubbel, Tripel, Quad) even if it was not brewed from a monastery belonging to International Trappist Association? I know what a ""trappist"" ale tastes like but what defines it if it's not location it was brewed?","I suppose one big question I’m wondering is I know I like Dubbels, Tripels, and Quads but I’ve always been unsure if I can call them any specific umbrella term other than “Belgians” since the term Trappist is designated for beers brewed at 12-13 specific monasteries. Belgians is pretty opaque and vague and there can be Belgian style lots of beers that aren’t Dubbels, Tripels, and Quads.

what can I call Dubbels, Tripels, and Quads as a single name or umbrella term that isn’t Trappist? Is it “Abbey Ake”? Is that the right term?",beer
253,t3_w4wnwi,VelkyAl,Olde Mecklenburg Berliner Weisse,"Wow, simply wow.

Didn't have any syrup as they were out of the woodruff and I am not a fan of fruity syrup in my beer.

The base beer though is magnificent and well worth trying if you're in Charlotte, NC.",beer
254,t3_w504cs,redditapi_botpract,Heineken Slim Can Tastes Significantly Better than the other cans / bottles,"Idk what it is, but the slim can version of Heineken tastes significantly more smooth and less watery than the other bottles and cans of Heineken. Why could this be?

I also think that bud light tastes better out of the aluminum bottles, that's the only way I'll drink it because it tastes better too.

Is it the way they bottle/can it? Can that affect the taste?",beer
255,t3_w4v9yp,yunggnomeshawty,Importing German Beer to the USA - Can it be Done?,"Hello everyone. I am trying to get my hands on Berliner Kindl, a classic Berlin-made pilsner. My local super markets and spirit stores carry some Paulaner and Warsteiner beers, but not much else. I have called German bars in my area to see if they have it, and none of them do. I'm starting to think I may have to personally import the beer from Germany. 

A few questions:

Has anyone here personally imported beer from Germany? If so, what company/service did you use? How much was shipping? Was the process lengthy?

I appreciate any help. I am looking for this beer because I was drinking it often while I was in Germany, and I have good memories with it. For my state, as long as I import 288 ounces or less there is no problem with the alcoholic beverages bureau. Thank you!",beer
256,t3_w4tvem,Reddit-is-trash-lol,Is Tavour bugging out for anyone else?,"I’ve been getting monthly mixed 12 packs without too many issues, but this past week has been ridiculous. When I checked the app last week it was all set to ship out over the weekend. I never got an email notifying me about shipping so I checked the app again and I had no beers in my monthly crate. Emailed support and they fixed it telling me it would be delayed a week. Today I check the app and there’s only 1 beer in it and I’ve been charged $132.50. 

I’ve had a few cans not survive the shipping, which I can understand, but why is there app so buggy? It also constantly logs me out for no reason.",beer
257,t3_w4yhld,ViolentBr33d,Sticker Trade,"Hello, wondering if anyone wants to trade some brewery stickers. Most of mine are Colorado/California. Hit me up!",beer
258,t3_w4o5c3,Prestigious-Wish-760,Tennents Lager,"Read a review online on this site called onlycans.me, was wondering if anyone had tried it cos it sounded good.",beer
259,t3_w4cjar,Jrjd94,Anyone know where to find Kilkenny Irish Cream Ale in Toronto?,,beer
260,t3_w3lndj,OneMorePint401,"Augustiner, one of Munich's most beloved breweries. Here are some of its best beer gardens and beer halls to try next time you're in Munich",,beer
261,t3_w4qung,BR_Rango,Is a golden ale and a lager basically the same thing?,"Title basically, this local brewery doesn't have a lager instead they have a golden ale.

Is this essentially just marketing? It more or less looks and tastes like a lager.",beer
262,t3_w4g3x1,AutoModerator,Throwback Thursday - classic beers and reviews of vintage bottles,"This post has a dual purpose.       

Tell us about classic beers people are still enjoying but not talking about anymore (beers like Duvel, Allagash White, Old Rasputin, etc.).       

Also, post your review of vintage bottles pulled from the cellar.  How's that 20 year old lambic drinking?",beer
263,t3_w4eaba,craftcitybrews,A generic craft brewery,"In Houston Karbach brewery was regarded as one of the go to brewery spots until AB in bev acquired them, now they make plain beers in mass and ship it around the U.S. just wondering how far karbach beer is seen and have you tried the old stuff?",beer
264,t3_w44er6,HuckleberryFun6261,what flavor makes beer enjoyable,"before i start, i'm pretty new to beer, so while i understand my takes may upset some beer enthusiasts, these are just my honest thoughts.

I recently started drinking more beer. Before i drank it, but i never liked it, kinda just forced myself to get it down. Now, i wouldn't say I enjoy it, but its not bad either. Idk, kinda in that neutral phase. Of course, a few beers does relax you a bit, which also makes it a bit enjoyable.

My favorite beer out of the light beers that I've had is coors light. it's carbonated, light, nothing crazy. I've also had some guiness, which didn't gross me out like some craft beers or ipas. of the few beers ive tasted, its one of my favorites so far.

so my question is, what makes people enjoy the taste of beer. Of course, its an acquired taste, but even then. The taste itself, especially with light beers, is pretty mild. Like a can of coke has way more flavor than a bud light, i don't think anyone can really argue with that. To me, light beer tastes pretty much like nothing, with an aftertaste thats a bit bitter and malty. Thats about it. 

So you always here how people come home after work and crave a beer or something. is that the flavor thats so enjoyable to them? I'm sure higher quality craft beers have more flavor and nuance. But plenty of people enjoy light beers, so why is that? how long did it take you to go from, this is alright, to,  man i really want a beer right now.",beer
265,t3_w3w1bc,k1lk1,Can you recommend any Vienna lagers?,"I don't think I ever had a Vienna lager until recently, at least not one branded as a Vienna lager.  But I was in the mood for a low ABV, refreshing, beer at a place near here, and they had one on tap.  I enjoyed it - similar to an American amber, I guess.  Maybe lighter.

Do you have any Vienna lagers you'd recommend trying?  I'm located in NYC in case it matters for regional availability.  I'm also interested in similar styles.",beer
266,t3_w46uvc,eatasssnotgrass,What’s your tolerance?,"Found out mines about 6 12oz 6% abv cans

Currently trying to sweat it out",beer
267,t3_w3wd92,johndoe5643567,What are the top five beers you’d recommend from this tap list?,"Going to Cincy next week. Amazing Belgium tap list. Curious if you guys have recommendations to try. 

https://authenticwaffle.com/biers-otr/",beer
268,t3_w49et1,RamenTheory,Seeking places to buy bottles/cans of craft beer around midtown NYC,"I'm getting more and more into beer lately, and I really like trying different kinds of unique beers. There's lots of great bars around, but I also like buying bottles/cans of beer to try at home.

I'm looking for more beer shops that have unique or interesting selections I should check out in midtown NYC. Of course there is Craft + Carry, probably the epitome of what I'm looking for, and it would *almost* be perfect except the beer is a bit expensive – $32 for a pack of 4. Not sure if it's reasonable to expect less than that, but honestly sometimes I just look online to see what they have this month and then order it myself directly from the brewery it was made from for only around $20 or less.

So, any recs for shops that have both a good selection and perhaps aren't super pricey? Am I being unreasonable?",beer
269,t3_w3n1nh,beertraveler98,Heading to Maine for a brew trip.,"What’re the must do breweries and places to eat in Portland. I’m definitely hitting Bissell brothers and Allagash (specifically for their brewery tour). Extra points if you have an Airbnb or hotel suggestion closer to Bissell bros. 
Thanks and cheers!",beer
270,t3_w3ffq9,Dollface_Killah,The World’s Most Remote Brewery?,,beer
271,t3_w36apo,barrysmithnp74,How bottling closer to home can help the drinks industry adapt to rising costs,,beer
272,t3_w3lqku,AutoModerator,No Stupid Questions Wednesday - ask anything about beer,"Do you have questions about beer? We have answers! Post any questions you have about beer here. This can be about serving beer, glassware, brewing, etc.

Please remember to be nice in your responses to questions.  Everyone has to start somewhere.

Also, if you want to chat, [the /r/Beer Discord server](https://discord.gg/MvMVFA4Vu3) is now active, so come say hello.",beer
273,t3_w366sr,Trashboot,"Hope this is okay here. Made a sub for posts about man's best drinking buddy, all breeds and brews welcomed!",,beer
274,t3_w31ezx,Yepitsn8,Sierra Nevada Atomic Torpedo,So I was browsing my local Stater Bros and spitting this bad boy in a 19.2oz tall boy. Decided to grab and holy cow for 3$ I don’t think you can do much better. 8.2%abv and it’s smooth and very juicy. Have any of you tried this gem? Any recommendations for other tall boys in similar vein? I also picked up Lagunitas Hazy wonder Tall boy and will drinking that soon,beer
275,t3_w3v25j,Isorg,Beer Half Full,"We are trying to do a weekly video on our local breweries and brews.  And I want to share.  

Houston’s Frost Town Brewery. 

https://youtu.be/onHjVpB1cLs",beer
276,t3_w46fld,TheMexicanADUwU,hi hi i like beer so let's chat,"i like different types of beer, i like some IPAs, light beers, blonde beers, one amber beer, belgian beer, german lagers and so forth. in general it's a case by case basis if i like it or not but my question is this, i buy beer obviously in store and i know sometimes a case can be quite old like a few months old. At what manufacturing date would you all suggest i don't buy from? 

So for example if i look at some beers and the box says it's been 3 months since bottled is that old? OR do some beers travel better/keep their luster longer? Sorry if my question doesn't make sense i don't know how to word it properly.",beer
277,t3_w3dvli,LongIsland1995,American craft pilsners,"I tend to enjoy craft pilsners, some more than others. I rarely dislike them but some are a bit disappointing because they either have an IPA tier hoppiness or are too floral. I used to like Coney Island Mermaid Pilsner a lot, but I wasn't as into it last time. Not sure if they changed the formula to make it hoppier or my tastes changed over the years. 

I welcome innovation and don't think these need to taste exactly like a classic German or Czech Pilsner. But prefer that they don't try too hard to be typical ""loud"" American craft beers. 

What are some American pilsners you'd recommend?",beer
278,t3_w2ws41,omnibusplease,"Visiting Syracuse this weekend, where should I go?","Hey all,

Making a quick road-trip to Syracuse, NY this weekend to see a band (Cave In) and should have a couple hours to kill Saturday afternoon.  Brewery recommendations?  No restrictions on style or anything.  

Would also appreciate bottle-shop recommendations so I can bring stuff home (coming from Canada).

Thanks!",beer
279,t3_w3fnnw,paramountducker,Stone IPA Liquid Poem,"I grew up in LA, but went to SD for college for a couple years when I was in my early 20’s. I worked at this grill/bar near my college for some time and during my time there, beer was pretty much free. They had Stone on tap and I felt in love with IPA’s! I love SD IPA’s like Stone and Ballast Point. 

I recently had some Stone IPA Liquid Poem which is a double IPA. Have any of you guys tried it? I freaking love it! 

I know IPA’s get a bad rep, but I always liked IPA’s. What about you guys? What’s another good IPA to try?",beer
280,t3_w37acr,ecxtts_,Lager suggestions?,"Heavily gotten into trying all the different lagers/pilsners since turning 18 2 years ago and so far I’ve discovered that Poretti and Erdinger are probably some of my favourites. I am aware Erdinger is a wheat beer by the way. I live in the UK so any suggestions would be nice if they’re easily accessible over here. I’m quite into the hoppy lagers such as poretti and I really enjoy Singha, in other words Italian and Asian beers. Just anything that has flavour that isn’t Budweiser basically.

I’m also trying to get more into IPAs and craft beers since there’s such a big variety but I just don’t enjoy the bitter taste so any suggestions to start me off there would be appreciated too.",beer
281,t3_w2w63a,abm131313,Beer name help?,"Hey guys, I recently got commissioned to come come up with a beer label for a local brewery. There just one problem we have to come up with a name first. The beer is a coconut &amp; almond barrel aged stout. Any name suggestions?",beer
282,t3_w3a55i,____no_u,So hard to find variety besides seasonals anymore,"Maybe it’s my area, but the only thing our stores seem to carry anymore are:

- 10,000 IPAs (especially hazies)
- ciders and super fruity beers
- seltzers
- typical American pisswaters
- typical imports

Is this happening where you live?",beer
283,t3_w2vdg6,Eudaimonics,A beer with a side of history at BriarBrothers Brewing in Buffalo,,beer
284,t3_w289y8,kbradt83,Is there a slang word for the mismatch beers in the back of the fridge that never get drank?,Usually from guests who leave the extras or sampler packs or just didn't like them.,beer
285,t3_w2g8uw,skesisfunk,Why no love for wheat beer???,"I have always enjoyed wheat beer but for whatever reason this summer I have really been craving them hard. Seems like I chose the wrong summer for this though. I have recently been to several liquor stores of the big and giant variety, the kind that have 2-3 aisles of craft beer, and in each one I can find 40+ varieties of hazy style IPA but might be able to only find one wheat beer offering if I am lucky. Literally have scoured the aisles of some of these stores and not found a single wheat beer!!! WTF? Am I really this out of step with current beer tastes? Does no one else enjoy drinking a wheat beer on a hot day??? Does everyone really dig hazy IPA so much in comparison that it justifies practically half of any given liquor stores craft beer stock being hazy IPA?",beer
286,t3_w36y5f,skateordie226,I have a very peculiar 24 year old beer.,Relix Hefeweitzen Edition. Bottled 6-28-1998. Should I drink it??,beer
287,t3_w2vvr0,kenflannery,I drank at 28 breweries in ONE DAY walking around Portland. Anyone else come close to this record?,,beer
288,t3_w2yo6u,DoItForPiggy,ISO Bud Light Cherry Cola Seltzer Tallboys,Hey friends! I had a bud light cherry cola seltzer tallboy at a concert a few weeks ago and have been on the search for them ever since. Does anyone know where these are sold? I’m in metro detroit and have tried various gas stations and Total Wine but no luck so far.,beer
289,t3_w363pt,coyote8721,IPAs,"I’m sure this has been discussed / unpopular opinion:

I think IPAs are the easiest beer to make. They mask real flavor with hops.",beer
290,t3_w2efut,MuMoike,Best Pilsner recommendations?,"I want to try out craft or just straight up good Pilsners, there’s a Total Wine and a couple of other stores in town so something I can probably pickup from there would be ideal, thanks!",beer
291,t3_w2d9ke,noblecustom,Thank you!,"I went from not really liking IPA to only enjoying one and when I couldn’t get it on the east cost (Alvarado’s Mai Tai) I made a post here. You all gave me some awesome advice and now I’ve tried some more tropical IPAs and while some were a miss, three of them are incredible and I never would have tried them without your input. They are - Goose Island Tropical Beer Hug, Blue Point Imperial Sunshine and Voodoo Ranger Juice Force IPA.  Anyway, just wanted to say thanks for the guidance, cheers!",beer
292,t3_w2j0lu,Muted-Ad-4352,I’m from Wisconsin and trying to find red horse anyone know?,,beer
293,t3_w2glf9,myotherprofileis,San Juan Breweries,"San Juan, PR has a lot of breweries! I'm totally unfamiliar with the scene there, so any recommendations? 

I found a few breweries, brew pubs, etc. but expecting to stay in San Juan proper and looking like centering in Puerta De Tierra.

&amp;#x200B;

* Santurce Brewery
* Ocean Lab Brewing Co.
* Cafe Bar Old Harbor Brewery
* El Tap
* 100x35 Beer Boutique",beer
294,t3_w1yrqg,AutoModerator,Monday Morning Quarterback - beer recommendations and recommended beers,"Recommend or ask for beer recommendations.  Did you try anything particularly great this past weekend?  Let us know!  Do you want recommendations based on that beer or others?  Ask away!       

For example, ""I like X beer, what else would I enjoy?"" or ""I drank this Weisse beer, and it was really good.""",beer
295,t3_w2hm39,LeefHound,Camping Session Beers - Suggestions,"Hey guys. I am a bit of a beer snob in the fact that I like good tasting beer. I like almost all styles of beer. However, when it comes to session drinking I have often chosen German Pilsners and Lagers. Think Becks, Bitburger, Lowenbrau, Warsteiner, Wernsgruner and what have you... These are great, and I may do it again. But as a change up I would like other suggestions for session beer that taste great. You know how you can get those good tasting beers but by your 3rd or 4th beer you think to yourself ""this taste is getting old!"". I dont want to run into that problem.

I do like IPA, stout, Ale, Pilsners, Hefeweisse. I think my least liked ""good beers"" are the double and triple abbey ales like Duval, Unibroue stuff like La Fin Du Monde. I dont mind one or two but I really sont like super champagney and excessively carbonated beer. Keep in mind by day 3 these beers may be getting fairly close to room temperature and if you know one thing...IPA taste like SHIT when its almost warm.

I was thinking of session IPA's for night 1. Lagers and Ales for night 2. Heffeweisse for night 3 and stouts for the end of the week...I dont know what it is but I dont mind and can handle stouts at room temperature.

Throw me your best sessionable camping beers!",beer
296,t3_w296sh,Living-Dependent7645,Opening a bottle cap barehanded,"Obviously, I am referring to regular crown caps, not twist-offs or whatever. And of course no rings, lighters, tables etc. being used.

I’m asking because outside of a questionable video on YouTube, action movies, and a few stories I’ve heard about people’s grandads who were sailors I’ve never actually seen it done. 

But perhaps a sober person on this subreddit has (somehow that seems more reliable to me.)

So has anybody here seen someone open a bottle cap barehanded? Or better yet, done it themselves?",beer
297,t3_w1apvs,connorthedancer,"Anyone tried Tsingtao? Never come across it before (in South Africa), but I really enjoyed that light malt taste. Is it more common in your county?",,beer
298,t3_w2ic5r,japanafterdark,American IPA West Coast SHOWDOWN!,,beer
299,t3_w1h1to,InvestForYourself,Question about beer glasses,"So, I’ve been getting more into beer lately and have been going to a place you can pour your own beers. We have the option to choose between what I would consider a “normal” beer glass vs my other option that I believe is like a Belgium taster glass. What is it used for and can I drink any type of beer out of it?",beer
300,t3_w1cu26,Puzzleheaded_Dish_85,Pilsner/Lager Recommendations,"When I first got into beer upon turning 21, I was all about the IPAs and Stouts.  At one point I went through a phase where I basically wouldn’t drink beer under 7% ABV. 

While I still enjoy these, I find they sit heavy and I can’t do more than one anymore. 

Been getting into Pilsners (and lagers) lately and really enjoying their lightness/crispness. 

I live in Saint Louis and have been trying some Pilsners/Lagers from our local breweries (namely Schlafly and 4 Hands… god we have an awesome craft beer scene here)

What are some other brands/styles of pilsners that are tasty?",beer
301,t3_w0or07,ChickenTeriyakiBoy1,"19th century beer cave rediscovered in Winterset, Iowa",,beer
302,t3_w1ty4v,techsuppr0t,Have yall ever gotten a weird kind of drunk from certain beers?,"So a few years ago I regularly drank stuff like 9% voodoo rangers, but I had some elysian space dust one night and actually blacked out and did some crazy shit which literally has never happened to me any other time. When I came to it felt almost trippy, like I had been microdosed acid or something but also still drunk. Honestly it sounds crazy as I'm writing it but I am known to handle my shit really well and usually alcohol just feels the same to me but I understand hops are very similar to cannabis and may have their own very mild effects if anything.",beer
303,t3_w0syr0,beerisgoodforu,What is your favorite beer made/produced by one of the big conglomerates?,Mine has to be Leffe Blonde.  Sure it's owned by INBEV but this is one of the best tasting and cleanest Belgian blonds on the market.  Also a plus I can find this for $9.99 a six pack on the reg near me.,beer
304,t3_w0t3oa,WickeDemon15,Best beers for micheladas?,,beer
305,t3_w0gwoz,aj_ssrn,"Is there a name for the type of beer that neither has hops nor any other bittering spice, but also does not have any additional fruit flavors added to it?",,beer
306,t3_w0v6s1,cancerlad,Is there a reason some high ABV beers make me feel sick by the end of them?,"There are some beers I’ve had that are high ABV(10%+), that made me somewhat sick by the end of them, a Belgian tripel, and a strong dark ale. Other high ABV beers I handle fine, is there a reason for this? Or is it something that will get better with more experience drinking? I haven’t even had this issue with anything lower.",beer
307,t3_w0ygfe,hobosyan,"Only risks, zero benefits for young adults that drink, but after 40 red wine is fine…",,beer
308,t3_w0qkzh,tikimura,Pairing for Belgian beers,"I want to make degustation of Belgian beers for friends and was thinking how to pair it with food. I was thinking about cheese(not sure which, maybe brie?) some jamon and crackers
We will have these beers:

Val dieu brune
Trappist Rochefort 10
Chimay triple
Bons voeux 
Oude geuze de oude cam

What would be good choice for these beers?",beer
309,t3_w0b5na,AzzaxB,What is everyone’s favourite Aussie Beers (beers sold in Australia native or imported),,beer
310,t3_w0kcq2,IrishAmericanDude02,Murphy’s stemmed pint glass,My dads favorite type of glass is the stemmed Murphy’s pint glass. We have only found them when we have traveled to Ireland. Does anyone know where I could purchase one.,beer
311,t3_w0i9ur,I_eat_naughty_kids,"Any good Belgian White Ale available in Silesia, Warsaw, or Toruń?",Northern parts of Czechia are also an option,beer
312,t3_w0zymk,sharkletts,Is a 24oz modelo negra too much for someone who hardly drinks? It contains 5.4 % alcohol,,beer
313,t3_vzvikp,WebDev27,Just tried my first rochefort 10,"And it dethrone my 1º place, gulden dark (class/white one). It is more robust, like if the gulden drak is the female version of this.

Altho I was a bit overwhelmed with how it hit me. it has same concentration (0.7% more) then a golden drak but hited harder. Still i enjoy a good beer high.",beer
314,t3_vzpw48,FuckYeahGeology,Craft Beers in Dublin?,"Hey guys,

I'm flying to Dublin tonight and staying there for a week. While I'm 1000% doing the Guinness tour, I want to try some of the local craft beers while I'm there instead of just drinking the Big 4. 

What do you guys recommend I try? I'm more of an IPA and Stout kind of guy, but am open to trying everything while I'm there.

EDIT: Thank you all for the recommendations, I really appreciate it.

First night here I checked out Against the Grain on my way to Flannigan's (my friend wanted to go there), tried Whirl Domination by Oi which was FANTASTIC!

I did the Guinness Tour yesterday after the Irish Whiskey Museum. The Guinness tour was a lot of fun for me, especially with the tasting room and the Guinness Academy. My friend left early for a job interview so I had an extra beer at the brewery.

I also checked out the Beer Temple to try Galway Bay Brewery. It was awesome, with Lizard People being by far my favourites and highest rated beers. I'm likely going back for another flight or pint.",beer
315,t3_w03np4,idahotaters3,Similar beer to Sunriver Brewing Co. Rippin'?,"I'm a huge fan of Rippin' from [Sunriver Brewing Co.](https://www.sunriverbrewingcompany.com/year-round/) 

**Hefty whirlpool and dry hop additions of Citra, Mosaic and Amarillo hops make this award winning strong pale ale burst with ripe tropical fruit, freshly squeezed citrus and resinous pine. The finish is distinctly clean, crisp and hoppy, with a restrained bitterness.**

**6% ABV  50 IBU**

**Hops: Chinook, Citra, Mosaic, and Amarillo®**

[Beer Advocate link](https://www.beeradvocate.com/beer/profile/32451/215112/) 

Anyone have suggestions for anything similar in the SF Bay Area?  I've had my share of Russian River, Henhouse/ Lagunitas etc.. but would love to find something similar here.

Thanks!",beer
